track_id,caption
00289f72-fbb5-49fb-9e6e-d062b5eecae7,The restrained power character of this Orchestral Alternative Uplifting piece gives it a calm and pleasant quality.
003d0ee0-728d-42a5-9b90-ddfacb4e2817,This piece is described as Pop and conveys dynamic and neutral through its vigorous power character.
0071c830-64a6-4254-be3a-1cfd0611948d,"This piece is described as Pop and is marked by vigorous power, which gives it a dynamic and neutral and versatile quality."
00ab8ae8-04c7-4bb0-afcd-03c76096c5df,"A track featuring steady intensity with subdued and introspective, creating a thoughtful atmosphere."
00d81f29-74e0-4a2b-a03c-7cba1dc36ae4,"Marked by intense energy, this Andy Winehouse, True King Bass, and Tragic Magic Cello piece takes on a dynamic and neutral quality and comes across as versatile."
010d2929-8745-4bf9-8d17-e6c32e190e53,This Male Vocal and Hip Hop Techno piece is marked by vigorous power and has a dark and aggressive quality that feels powerful.
0146e85d-d3dc-4804-8ae2-47fdbf297a1f,"This Pop-Rock piece highlights intense energy and complex tonality, which gives it a dynamic and neutral feel."
01655156-ad80-4662-b8aa-a008c6ee0dd5,"With restrained power and dynamic tonality, this piece comes across as calm and pleasant."
02352df2-76ad-4e9c-b289-d1c5e3ddd408,"A Emotional, Electric, Alternative Rock track featuring balanced dynamics with ambient and atmospheric, creating a ethereal atmosphere."
025cb6c3-6d26-4304-9005-0d36e248c9a1,"This Female Vocals, Pop, and Rock piece is marked by strong intensity and has a dynamic and neutral quality that feels balanced."
029faa4b-4007-42d7-84dc-23bc23a36094,"With intense energy and mixed consonance, this City-Pop and Pop piece comes across as uplifting and energetic."
02e9e85a-c066-4b39-a0d8-1ed40a4d47e7,"This Jazz, R&B, and Clapping piece is marked by vigorous power and has a dynamic and neutral quality that feels versatile."
03354439-084c-4793-a44d-ed929caa8b40,The mix of moderate energy and high tension gives this Rock piece a ambient and atmospheric feel.
03dc40ef-e9cc-4003-8fd0-1743c2f8956d,"With strong intensity and high tension, this piece comes across as dark and aggressive."
03f7caf5-daa6-49ea-8160-f3bd53de6572,"With strong intensity and dissonant harmonic content, this Powerful Electric Rock piece comes across as dark and aggressive."
0421b0dd-6c18-47b6-8690-b04cfd77b8f1,"This Vulnerable Female Vocals, Honest, and Breathless piece is marked by intense energy and has a dynamic and neutral quality that feels multifaceted."
04a59171-94e9-4ee2-8781-c8ad67156d87,"This Hip-Hop, Latin Percussion, and Mariachi Trumpets piece is marked by strong intensity and has a dark and aggressive quality that feels powerful."
04f53d30-d1a2-4b29-b938-a1b0aad7483c,"A track featuring strong intensity with dynamic and neutral, creating a adaptive atmosphere."
051db367-c03c-4bbc-8825-e183eed27f7a,"A Gritty Intricate Gangsta track featuring intense energy with dynamic and neutral, creating a balanced atmosphere."
058c6f20-ffb3-4b78-ac6c-48c4a01c49bb,"A track featuring balanced dynamics with cheerful and gentle, creating a pleasant atmosphere."
05c34738-9776-44fa-ac31-eef1faa0f282,"This piece highlights intense energy and complex tonality, which gives it a dynamic and neutral feel."
05fcc7c7-7161-4dd6-99ab-5c448ef4bcba,"This piece is described as Pop Playful and is marked by high energy and powerful dynamics, which gives it a uplifting and energetic and exhilarating quality."
06fc804d-207a-4567-a6e3-139540cbc3e3,"This piece is described as Cosmic, Warrior Chants, and Gothic and is marked by high energy and powerful dynamics, which gives it a dark and aggressive and powerful quality."
07e75e38-76cc-4287-b0cc-2970188c419d,"Through its high energy and powerful dynamics character, this Mandelão Baile Funk piece comes across as dark and aggressive."
07f07132-326a-4d39-8139-ea643ef566ac,"The strong intensity character of this Folksy Lullaby, Whimsical & Cozy, and Soft Acoustic Guitar piece gives it a dynamic and neutral quality."
07f74a3d-8f3e-4a7e-9f99-be4f7dd19edf,"A track featuring moderate energy with ambient and atmospheric, creating a textural atmosphere."
08525ffb-8951-4e0d-8331-2d7e418da5f7,"Marked by balanced dynamics, this Electronic Cyberpunk Edgy piece takes on a ambient and atmospheric quality and comes across as spacious."
087b5155-0fd5-4620-a392-5101e7d88a5b,"This piece is described as Drum, Chanting, and Australian Music Style and is marked by intense energy, which gives it a dynamic and neutral and balanced quality."
089865b0-8886-4fa3-b778-45ca1e2aa0be,"This piece is described as House, Sampled, and Immersive and features high energy and powerful dynamics and high tension, giving it a dark and aggressive feel."
09a9c417-9d55-47f5-95b1-fb0d120d0b56,The mix of balanced dynamics and dissonant harmonic content gives this piece a ambient and atmospheric feel.
0a01f369-1f64-4de8-9097-cb9ac42583a4,"This piece highlights intense energy and complex tonality, which gives it a dynamic and neutral feel."
0a270cf4-8807-4aea-b3fe-0dde369650a7,"This piece is described as Scifi, Cosmic, and Violins and conveys dark and aggressive through its intense energy character."
0a40303c-db49-4e33-9c74-0bebdab97462,"With intense energy and unstable structure, this piece comes across as uplifting and energetic."
0a85aae0-57ea-424c-a0fd-d30d6f4ebd8f,"A Drips track featuring high energy and powerful dynamics with dynamic and neutral, creating a adaptive atmosphere."
0a996190-7a9c-452b-9805-c20077110a9c,"Through its vigorous power character, this Club-Trap Hip-Hop Dark piece comes across as dark and aggressive."
0b0d1709-d7f7-495e-9c4d-7f93ab61911c,"A track featuring intense energy with uplifting and energetic, creating a vibrant atmosphere."
0b1bdfb2-2755-4eb2-a5d1-f2d4395280a0,"A Hip-Hop, Electronic, Alternative R&B track featuring strong intensity with dark and aggressive, creating a powerful atmosphere."
0b4c51ca-e0ef-4a5f-a6cb-e4cfb6fbe5d5,"A track featuring high energy and powerful dynamics with dynamic and neutral, creating a balanced atmosphere."
0bc28071-9d0e-4778-bb37-d93067f1e551,This piece is described as Cheerful Quirky and conveys dynamic and neutral through its high energy and powerful dynamics character.
0bd35fdd-b864-4cf3-8874-bae5328fac80,"Through its strong intensity character, this Deutschrap, German Hip-Hop, and Hip-Hop piece comes across as dark and aggressive."
0be49c2a-a80f-433b-a42a-88383d7fdee2,"This Female Vocal, Emotional, and Midwestern Emo piece conveys uplifting and energetic through its vigorous power character."
0c33fc49-a81b-4144-a871-02b4cea33e75,"This piece is described as Psychedelic Rock and is marked by strong intensity, which gives it a dynamic and neutral and versatile quality."
0cb4c36c-0628-46a9-8642-699e57b03b08,"The mix of moderate energy and complex tonality gives this K-Pop, Horror, and Evil piece a ambient and atmospheric feel."
0ce21efe-7a69-44f3-80e8-bc9d1ba5ded7,"This piece is described as Metalcore, Ambient, and Technical Death Metal and features high energy and powerful dynamics and complex tonality, giving it a dynamic and neutral feel."
0d08573e-a144-46e1-a321-754f515e89f1,"This piece is described as Rap and is marked by strong intensity, which gives it a uplifting and energetic and dynamic quality."
0d2c89db-0216-4aaf-a6ab-9b6e828a6606,"This Anthem Rock, Soft Rock, and Electronic Rock piece highlights intense energy and complex tonality, which gives it a dynamic and neutral feel."
0d65fe3c-f6f5-4521-b846-99c5ce1c8704,"A Pop Rock track featuring calm intensity with calm and pleasant, creating a soothing atmosphere."
0ebfefea-7a7d-45df-ad3b-d0e0efd22a7a,"The intense energy character of this Cajun, New Wave, and Rock piece gives it a uplifting and energetic quality."
0f031ff3-8ddc-4e6d-9188-7162791b3886,"A Vocal Powerhouse, Vocal Ornamentation, Perfect Eq track featuring vigorous power with dark and aggressive, creating a intense atmosphere."
0fa18eb0-2049-41b6-88e3-71754331884f,"This Mechanic Female Voice, Dark Electro, and Epic  Bass piece is marked by measured power and has a calm and pleasant quality that feels soothing."
0fd4aa0c-ff74-4ef0-ab4f-0fa2a9d36283,"This piece is described as Traditional Gospel and features high energy and powerful dynamics and unstable structure, giving it a dark and aggressive feel."
103c040d-0d3e-4b81-839f-c232d4cf29fc,The mix of intense energy and dissonant harmonic content gives this piece a dynamic and neutral feel.
1049ed60-d552-481d-8c87-0a7803987721,"With high energy and powerful dynamics and complex tonality, this Electro Swing, Video Game, and Catchy piece comes across as dark and aggressive."
104c3597-aad7-47fe-b1cb-38c8fa1c5cfb,"This piece is described as Childeren Poem, Childeren Song, and Kidss Poem and is marked by intense energy, which gives it a dynamic and neutral and multifaceted quality."
107086e1-1eff-47bc-9c1c-4febb0fd94c1,"A Black Metal, Chamber Orchestra, Heavy Riffing track featuring moderate energy with calm and pleasant, creating a peaceful atmosphere."
1074275a-1f73-459b-902f-e936aa92edab,"With high energy and powerful dynamics and unstable structure, this piece comes across as dark and aggressive."
10c1b3a5-bbde-47b7-8bb9-b1a574c80bf5,"This piece is described as Phonk Intro, Super Bass, and Hiphop and conveys dark and aggressive through its intense energy character."
11121719-35f1-4863-9475-227d4aac4830,"This Pop Duet Lively piece highlights measured power and mixed consonance, which gives it a calm and pleasant feel."
11bb90ee-6db9-4c52-8a2c-dd0a6da4847d,The mix of high energy and powerful dynamics and dissonant harmonic content gives this New Orleans Trance piece a dark and aggressive feel.
11ff4b80-e150-47a2-8a1d-d4bff0935733,"This Power Metal, Ska- Core, and J-Pop piece is marked by vigorous power and has a dark and aggressive quality that feels intense."
121dae8d-25fe-491f-b63b-eb304575aac8,"Marked by moderate energy, this English and Steel Guitar piece takes on a calm and pleasant quality and comes across as peaceful."
128ad174-8020-4040-bb2f-c6eb3c6219f7,"This piece is described as Rap, Techno, and Trap and is marked by strong intensity, which gives it a dark and aggressive and forceful quality."
12aa47b6-b909-42a2-9211-00f244229b7b,"This piece is described as Sad Trap and Rock and is marked by intense energy, which gives it a dark and aggressive and forceful quality."
12d19149-1ece-4f3e-ba42-6f218b253536,"A Upbeat Rock, Slow Progressive Rock track featuring intense energy with dynamic and neutral, creating a versatile atmosphere."
133721ef-b0d7-4176-a4d9-e0376dbf7f0d,"This piece is described as Pop, Alternative Folk, and Emotional and conveys dynamic and neutral through its intense energy character."
1479e265-9e36-4647-91fc-47a8e6dae3c9,"A track featuring intense energy with dark and aggressive, creating a powerful atmosphere."
148158e6-5940-40a5-8da9-576e85752850,"Marked by vigorous power, this Cinematic, Trip Hop, and Urban piece takes on a uplifting and energetic quality and comes across as lively."
1487eaec-69d3-473b-8ac9-1989b8d529e6,"Through its strong intensity character, this Salsa piece comes across as dynamic and neutral."
14a46498-a3db-4ffe-995c-26d514feb1f3,"With balanced dynamics and dynamic tonality, this Drum And Bass, Jungle, and Hardcore piece comes across as ambient and atmospheric."
14baa8a0-afa9-4df4-b85f-d98444f6675c,"Marked by strong intensity, this Death Metal, Beat Displacement, and Brutal piece takes on a dark and aggressive quality and comes across as powerful."
14f03b9a-fc03-4391-bbd5-5db63a1ace8c,"This High-Energy Pop, Playful, and Electric Beats piece is marked by high energy and powerful dynamics and has a dynamic and neutral quality that feels adaptive."
150a08c6-fe4b-48c3-9567-bcd223520d0a,"This piece is described as Laid-Back Jazz Soulful and is marked by vigorous power, which gives it a bright and vibrant and spirited quality."
153b8811-cae4-4d3b-b075-e89000d6eb26,"A Rock Dinamika track featuring strong intensity with dynamic and neutral, creating a balanced atmosphere."
15d3fd0d-d029-434f-8e12-bab4f47568a2,"With strong intensity and complex tonality, this piece comes across as dark and aggressive."
160df0e2-673b-40e3-bd5d-b5a33d89ee5d,"This piece highlights vigorous power and complex tonality, which gives it a dark and aggressive feel."
1611d28b-57cb-479a-811e-f793843c6d10,"This Introduction] Indian Sitar, Accompaniment] Tabla, and Sarod [Solo] Flute piece is marked by strong intensity and has a dynamic and neutral quality that feels adaptive."
1632afe0-1a5e-42eb-b204-b275106e7f0b,The restrained power character of this Electronic Uplifting Enchanting piece gives it a cheerful and gentle quality.
16beb7d8-1963-4216-a45b-b8c4390a09dd,"A track featuring strong intensity with dark and aggressive, creating a commanding atmosphere."
171ab4d7-9d93-4216-bcbf-b9607d85d1f2,"A Reggaeton, Trap, Rap track featuring high energy and powerful dynamics with dark and aggressive, creating a powerful atmosphere."
17384a26-cbbe-4622-b7d0-f22dfcf7e0ea,"This piece highlights high energy and powerful dynamics and high tension, which gives it a uplifting and energetic feel."
17829140-e1a5-44e3-aacc-6e98dec54b9d,"The mix of strong intensity and dissonant harmonic content gives this Rap, Hip Hop, and Electro piece a dynamic and neutral feel."
17c55f82-fceb-4941-9115-926f0f135d02,"This Pop piece highlights strong intensity and high tension, which gives it a dynamic and neutral feel."
17d9b625-3277-4d4a-bfc7-f95098b97767,"A Rock And Roll track featuring balanced dynamics with calm and pleasant, creating a tranquil atmosphere."
17ef4295-c87e-4772-9fb5-2c769cf1e726,"With high energy and powerful dynamics and high tension, this Hard Rock and Female Singer piece comes across as dark and aggressive."
18400a78-8211-4c36-b61b-52bcf2cc13f5,"A Electronic Avant-Garde Experimental track featuring strong intensity with dark and aggressive, creating a forceful atmosphere."
187e2273-fb3b-42a6-942c-4626852fd6bb,"With intense energy and complex tonality, this piece comes across as dark and aggressive."
18a969ce-8e91-40a0-b242-88496816951d,"A Junglist Dark Electronica, Pulsating Basslines track featuring steady intensity with ambient and atmospheric, creating a ethereal atmosphere."
18d25b02-3e4f-4ab1-b37c-c245e62c62cd,"This piece is described as Makedonski Rap and Trap and features vigorous power and high tension, giving it a dark and aggressive feel."
19589f4c-6d94-4322-93bb-c7f2044bf778,"A Pop track featuring strong intensity with dynamic and neutral, creating a adaptive atmosphere."
19e09706-40b5-4980-8b1a-870ea9ec4ab1,"A Rap, Hip Hop, Diss Track track featuring strong intensity with dynamic and neutral, creating a multifaceted atmosphere."
1a1c1909-4d05-430c-b9dc-b57e7d996ce0,"The strong intensity character of this Mysterious, Dubstepcore, and Dubstep piece gives it a dark and aggressive quality."
1a3226ce-d6a5-4f4a-b6b7-4e648e34e3c0,"A track featuring high energy and powerful dynamics with dynamic and neutral, creating a multifaceted atmosphere."
1aa2c635-ae32-4ab2-95a2-8b431d13c7dc,"A Nu Metal, Electronic Rock, Pop track featuring intense energy with dynamic and neutral, creating a multifaceted atmosphere."
1af9abf0-ed40-4d22-bc95-b1c67850f3c0,"This piece is described as Angola and Afro and features vigorous power and high tension, giving it a dark and aggressive feel."
1b73968f-6771-492a-a942-c3c9a10336b6,"This piece is described as Heartbroken, Moody, and Lo-Fi and is marked by high energy and powerful dynamics, which gives it a uplifting and energetic and vibrant quality."
1ba47840-dc20-4a4d-ab63-009a245b0602,"This piece is described as Progressive Build-Ups, Glitch Beep Fx, and Heavy Percussion and features balanced dynamics and dynamic tonality, giving it a calm and pleasant feel."
1be87f45-c01e-435c-94db-c483c8acbb3e,"This piece is described as Tone and is marked by strong intensity, which gives it a dynamic and neutral and balanced quality."
1c03f62d-dc0f-4b46-8a94-2eeb2e09bb0f,"Marked by intense energy, this Songwriter, Acustic, and Umplugged piece takes on a dynamic and neutral quality and comes across as multifaceted."
1c17730a-4b6e-4d24-9802-6e11c02eff89,"A track featuring high energy and powerful dynamics with dynamic and neutral, creating a multifaceted atmosphere."
1c357871-fe06-4eed-a14a-1b51bb1a8e58,"A track featuring moderate energy with ambient and atmospheric, creating a textural atmosphere."
1c4c6c01-fedc-4d7e-9e7d-b784bbe47a3a,The measured power character of this Soothing Tranquil Ambient piece gives it a calm and pleasant quality.
1c568b9d-209c-4d81-ad0a-60b4ff967f16,"This piece is described as Instrumental Rock Ballad, Horror Music, and Film Scores and conveys ambient and atmospheric through its moderate energy character."
1c81b250-c878-4a65-afc4-b5038458c594,"A Lighthearted Kid'S Song track featuring intense energy with dynamic and neutral, creating a adaptive atmosphere."
1cdaf471-f892-49e6-a36b-e048181a8597,This piece is described as Jazz and Jamaican and conveys dynamic and neutral through its high energy and powerful dynamics character.
1ceb9deb-0360-482d-a2f8-73575d3e6b0e,"This piece is described as Alternative Rock, Singer-Songwriter, and Thx Stereo and features moderate energy and unstable structure, giving it a ambient and atmospheric feel."
1d0044c9-50e6-423c-a039-6a9d2c52f96a,"With steady intensity and high tension, this Hopeful, Pop, and Uplifting piece comes across as ambient and atmospheric."
1d12373d-b531-4968-ba90-fced67823210,This piece is described as Reggae and conveys dynamic and neutral through its high energy and powerful dynamics character.
1d12dde4-7c3e-4a49-adc4-c6670efa8d56,"A Rap, Hip-Hop, Trap track featuring high energy and powerful dynamics with dark and aggressive, creating a commanding atmosphere."
1d8621be-4b76-41bd-9851-b38af6e603fd,"A Ambient Electronic Atmospheric track featuring steady intensity with calm and pleasant, creating a tranquil atmosphere."
1da4036e-894e-4521-9637-97792deda839,"A track featuring subdued energy with ambient and atmospheric, creating a textural atmosphere."
1dd0f339-f12d-4604-858a-8da997e7331b,The mix of moderate energy and dissonant harmonic content gives this piece a ambient and atmospheric feel.
1e295afb-cb8f-47c6-9350-0cdec8fdafbb,"A Symphonic, Classical Orchestral, Celtic track featuring steady intensity with ambient and atmospheric, creating a textural atmosphere."
1e95ed7c-cbfb-49ea-bee0-ecf4c6b2678b,The mix of steady intensity and dissonant harmonic content gives this piece a subdued and introspective feel.
1ea89754-00cd-4c23-a898-c77b14094e06,"A Genre: Nerdcore, Synth Strings, Brass Stabs track featuring high energy and powerful dynamics with dark and aggressive, creating a commanding atmosphere."
1eb9ec02-54ab-448d-a0d8-dacc6a051ef6,The vigorous power character of this Ballad Atmospheric Electronic piece gives it a dark and aggressive quality.
1eef117f-a75f-4d2d-ab5c-73febdf396a8,"This J-Punk Ska Pop, Akihabara Cute Pop, and Bubblegum Synth piece highlights vigorous power and dissonant harmonic content, which gives it a dark and aggressive feel."
1f85ee3c-5a11-44ad-bb18-c3e57b4f4179,This Melodic Bass-Heavy Techno piece is marked by high energy and powerful dynamics and has a dark and aggressive quality that feels intense.
1ffb455f-db00-456c-b18d-8afb491626b5,"A Waltz, Pensive Female Voice, Medium Tempo track featuring high energy and powerful dynamics with dynamic and neutral, creating a multifaceted atmosphere."
2002640a-04b2-449c-874d-793db81ec444,"A Jersey Club, Nola Bounce, Jungle track featuring high energy and powerful dynamics with dynamic and neutral, creating a versatile atmosphere."
206feaf3-940e-4ecd-af59-722a8e0bd787,"This piece is described as Edm, Compressed Bass, and Compressed Drums and is marked by strong intensity, which gives it a dynamic and neutral and multifaceted quality."
209307d5-3bab-4edf-8851-00bef45b9404,"A Russian Romance track featuring vigorous power with dynamic and neutral, creating a multifaceted atmosphere."
20bb682e-0925-4434-9016-41a8e8348bf3,"This piece is described as Duet, Deep, and Nuclear and is marked by vigorous power, which gives it a dark and aggressive and intense quality."
20ca208c-efcb-4e67-8a25-ae046827d6bd,"A Syncopated Anime, Sweet Female Vocals track featuring intense energy with dark and aggressive, creating a intense atmosphere."
210fb2d6-0cc8-4c06-8e4b-7689e8c501c9,"This piece highlights vigorous power and complex tonality, which gives it a dark and aggressive feel."
215db900-8b8f-4203-a9b3-5570b3432c55,"With calm intensity and moderate tension, this Orchestral Harmonic Classical piece comes across as calm and pleasant."
2162b9e0-a312-4a7d-af2b-994fd089076d,"This piece highlights intense energy and complex tonality, which gives it a dynamic and neutral feel."
220eea98-fedf-4bcb-87f1-45230928be28,"This piece is described as Space, Bleep Sounds, and Happy Song and conveys dark and aggressive through its vigorous power character."
226c49b0-672e-470b-a1c7-05ff640c15a0,"This Rock, Progressive, and Blues piece is marked by intense energy and has a dynamic and neutral quality that feels versatile."
229655be-c22f-4ec7-a59f-9125e53b1e7f,"Marked by strong intensity, this Rap piece takes on a dark and aggressive quality and comes across as powerful."
22c09a42-505d-4dae-b0c2-350841e4395f,"A Dirty Progressive Rock, House Jazz, Ambient Grunge track featuring vigorous power with dark and aggressive, creating a intense atmosphere."
22c52037-3381-4eef-8f3f-e444ef12efdd,The high energy and powerful dynamics character of this Bachata piece gives it a dynamic and neutral quality.
23255f35-3107-4545-a8da-4987f7345640,This piece is described as Hard Rock and Metal and conveys dark and aggressive through its high energy and powerful dynamics character.
2342662d-7dee-4dc5-b144-140296241a74,"The mix of steady intensity and dissonant harmonic content gives this Liquid Funk, Atmospheric Energy, and Jazz piece a ambient and atmospheric feel."
23bb0b5b-c08f-40f2-8bce-b5b7b1bd4ea8,This Somber Instrumental and Solemn Mood piece is marked by balanced dynamics and has a ambient and atmospheric quality that feels textural.
24ea4b6f-c69c-43c9-9da5-ee10192c02b5,"A Electro Pop, Synth Heavy, Hard Bass track featuring strong intensity with dynamic and neutral, creating a adaptive atmosphere."
251229ac-2894-43b2-8010-601f4aeedf82,The intense energy character of this Turkish Classical piece gives it a uplifting and energetic quality.
251b88b7-6b1f-4fad-8b5d-9add92386b47,"This Hip Hop, Trap, and Chicago House piece highlights vigorous power and unstable structure, which gives it a dynamic and neutral feel."
25864737-6583-4945-a012-d46e7898f628,This Pop Electronic piece conveys dynamic and neutral through its high energy and powerful dynamics character.
259f2197-9cf4-419a-9d3a-3c3f28709244,"Through its vigorous power character, this Synth-Pop, Industrial Rock, and Darkwave piece comes across as dark and aggressive."
25bfb672-546b-4bff-9749-697ae26ad447,"Marked by balanced dynamics, this Dance Music, Pop, and Stylish piece takes on a ambient and atmospheric quality and comes across as immersive."
25cf5270-a54f-4182-a561-df9e2d10c487,"This piece is described as Bengali Music and is marked by moderate energy, which gives it a cheerful and gentle and welcoming quality."
25d4de9f-058f-4a80-bf60-3f2476c42875,"This Male Voice, Alternative Rock, and Grunge piece conveys subdued and introspective through its measured power character."
25e13c2b-4c32-482e-84a0-206dbad7e671,This A Fierce and Female Voices piece is marked by vigorous power and has a dark and aggressive quality that feels powerful.
2600fc3a-96b8-42a8-9378-d2f3eb883b2f,"Marked by vigorous power, this Stuttering, Female Sultry Vocalist, and Koto Vibe piece takes on a dynamic and neutral quality and comes across as adaptive."
263a2be3-07b5-407e-b589-9ebd2cfe9a19,"A track featuring high energy and powerful dynamics with uplifting and energetic, creating a exhilarating atmosphere."
272c17f9-6c80-4d1a-8fb3-d390a2ab3dbb,"This piece highlights moderate energy and unstable structure, which gives it a subdued and introspective feel."
2743b8df-af68-4bc9-9862-f66f2436de6f,"This Start Slow, Whisper, and Sexy piece highlights moderate energy and complex tonality, which gives it a ambient and atmospheric feel."
27b26090-0b49-44dd-a1e3-111f7938aa74,This Style: Dance piece conveys dynamic and neutral through its intense energy character.
27ede5ad-8719-47cd-8632-7c5118600295,"A Comedy-Folk, Tone: Quirky, Absurd track featuring high energy and powerful dynamics with dynamic and neutral, creating a versatile atmosphere."
28467225-85c5-4c50-b40a-e770dd89da3e,"A Acoustic Melancholic Folk track featuring restrained power with calm and pleasant, creating a soothing atmosphere."
2890f7c9-60b4-46ce-bb89-3051aec85712,This piece is described as Electronic Quirky and conveys dark and aggressive through its vigorous power character.
28c238a0-8463-4713-9a5a-dc648b055016,"This piece is described as Classic, Neuro, and Drum And Bass and conveys cheerful and gentle through its restrained power character."
28f8c71f-9ab6-4487-99fb-b38d8e572700,"A Off-Beat, Satire, Norsk track featuring vigorous power with dynamic and neutral, creating a multifaceted atmosphere."
2956d3e3-0f61-4198-b669-59643f3689d9,The vigorous power character of this Fun Electronic piece gives it a dark and aggressive quality.
297865b8-c3a5-4d7c-ab5b-0b376a94ca5c,"This piece is described as Electronic, Dance, and Futuristic and is marked by intense energy, which gives it a uplifting and energetic and dynamic quality."
299a7bce-b8c8-4c91-80a9-a120ca5ee997,This “A Deeply Sad piece is marked by calm intensity and has a calm and pleasant quality that feels peaceful.
