track_id,caption
55c3ade1-dec1-4816-8f1a-3a23674fa938,"A Funky Groovy Retro track featuring strong intensity with dynamic and neutral, creating a balanced atmosphere."
55e78b34-c64e-4033-876e-90cd408de08a,The high energy and powerful dynamics character of this Skull Drum and Phantom Cello piece gives it a dark and aggressive quality.
561b91ed-7fca-4549-8518-ebd2382e05b5,"A Memphis Soul Blues track featuring vigorous power with dynamic and neutral, creating a adaptive atmosphere."
565510c8-5b7e-412d-a241-002bbcf56ce9,"With high energy and powerful dynamics and dissonant harmonic content, this Slowcore, Screamo, and Worship piece comes across as dark and aggressive."
569120e0-5a42-4298-b58c-c3533d90a840,The mix of intense energy and dissonant harmonic content gives this piece a dynamic and neutral feel.
5694f017-41fd-49c0-9996-48cca59ec2f2,"Marked by strong intensity, this Denpa, Glitchcore, and Electro piece takes on a dark and aggressive quality and comes across as forceful."
56a709e4-29b9-4797-80da-d55efb511c14,"This piece is described as Industrial Raw Electronic and features strong intensity and dissonant harmonic content, giving it a dark and aggressive feel."
56c4f6ba-89f5-4a9c-a217-62bf03b6bb9c,"This piece is described as Dance & Electronic and is marked by moderate energy, which gives it a ambient and atmospheric and ethereal quality."
574017a7-9205-4c58-abfb-7ab2a7bdfe6f,"A Lullaby, Nursery Rhyme track featuring high energy and powerful dynamics with uplifting and energetic, creating a lively atmosphere."
57b59d98-da78-43a9-8308-080aef10d075,"A English, Drum, Melodious track featuring vigorous power with dynamic and neutral, creating a adaptive atmosphere."
584019ee-d4a7-40f3-9ffc-b2f528d9f2bc,"With measured power and dynamic tonality, this piece comes across as calm and pleasant."
585cedce-6f40-4ed4-8f5e-a88b2ed2df5e,"With intense energy and complex tonality, this piece comes across as dark and aggressive."
58a65a64-c0e9-4c1b-b88f-6fbb4a60de17,"This piece is described as Pop Anthem and features balanced dynamics and mixed consonance, giving it a cheerful and gentle feel."
58baf8a4-eb98-4c52-bb45-264343f84657,"With vigorous power and mixed consonance, this Cinematic, Nu-Metal, and Rap Metal piece comes across as dynamic and neutral."
58eea245-6ea9-44b5-90bc-956bc6252980,The vigorous power character of this Pop piece gives it a uplifting and energetic quality.
58f9060a-5a98-4bf2-a0f6-b3bbc572d0e8,"This Havana Grime, Trap K-Pop, and K-Pop Female Vox piece is marked by vigorous power and has a dynamic and neutral quality that feels versatile."
590f8c5d-7f7c-4c1a-9835-0b63b49febc9,"Marked by balanced dynamics, this Female Vocals, Indie Rock, and Pop Ballad piece takes on a calm and pleasant quality and comes across as tranquil."
5950e615-0bb9-4746-bba4-f1d8b7dfe8d2,"Through its vigorous power character, this Rhythmic Urban piece comes across as dynamic and neutral."
59685864-3176-4679-a414-6d463d359c5f,"Marked by steady intensity, this Experimental, Emotional, and Hypnotic piece takes on a calm and pleasant quality and comes across as soothing."
596efbc6-9c10-4ded-8f24-9abbbf716628,"This Arabesque, Turkish Arabesque, and Spanish Guitar piece highlights moderate energy and dynamic tonality, which gives it a ambient and atmospheric feel."
59db3b7a-3dc0-4a58-91fb-351edb792010,"The mix of steady intensity and mixed consonance gives this Dangdut, Kecapi, and Seruling piece a cheerful and gentle feel."
5a2ff2bc-0658-41d6-ad1a-3ce70e3d8dd4,"The steady intensity character of this Jazzy, Urban, and Neo Soul piece gives it a cheerful and gentle quality."
5a627ca3-2b1f-4736-8e12-82f38e7e29d5,"Marked by intense energy, this Gangsta Rap, Sampled, and Scratches piece takes on a dark and aggressive quality and comes across as powerful."
5ae28a32-0a2b-4f33-b7df-f25da88ce102,"This Cajun, Opera, and Sea Port piece conveys calm and pleasant through its moderate energy character."
5b0e69b0-e6c3-4902-bb5e-bb579bebe535,"A Horrorcore, Horror, Circus track featuring strong intensity with uplifting and energetic, creating a dynamic atmosphere."
5b14f334-1066-4974-a32e-0371a07f3ba0,"Marked by high energy and powerful dynamics, this Hip Hop and Rap piece takes on a dark and aggressive quality and comes across as commanding."
5b15a832-d65c-41f2-a1d5-681ba6b5dc10,"This Pop, Female Voice, and Emotional piece highlights vigorous power and unstable structure, which gives it a dynamic and neutral feel."
5b208977-410c-423d-a1a6-11e97569a507,"This Eurobeat and Male Voice piece highlights low energy and gentle dynamics and consonant structure, which gives it a calm and pleasant feel."
5b808149-3344-4d78-9b98-c55c69213375,"A Singer Songwriter, Pop, Male Vocals track featuring strong intensity with uplifting and energetic, creating a vibrant atmosphere."
5c43e298-07e9-4756-a7d7-1ac137c096a9,"A track featuring strong intensity with dynamic and neutral, creating a balanced atmosphere."
5c4fd8c3-5528-44e6-bd63-6b462e75df76,This Upbeat Pop piece is marked by intense energy and has a dynamic and neutral quality that feels adaptive.
5c77bbea-d0da-45fd-b441-db2e0a36e24d,"A track featuring subdued energy with calm and pleasant, creating a serene atmosphere."
5cdf5b2c-2166-487c-b196-bf0a46ce7c9c,"A Synth-Heavy Synthpop Emotional track featuring measured power with subdued and introspective, creating a nuanced atmosphere."
5ce165b0-60c7-4728-848e-0fc7c8b5d764,"A Whimsical Psychedelic track featuring strong intensity with dynamic and neutral, creating a versatile atmosphere."
5cebc44c-7b94-439f-a119-6d1f21434e2e,The mix of strong intensity and dissonant harmonic content gives this piece a dynamic and neutral feel.
5d5a5ea7-3ad6-4ed3-b8ab-125904b2232b,"A track featuring steady intensity with calm and pleasant, creating a soothing atmosphere."
5d851e4a-ea9a-41ff-97fc-e7297c688fbd,"A Electro track featuring high energy and powerful dynamics with dark and aggressive, creating a powerful atmosphere."
5dc3d08b-2239-4c53-9f45-f4793b443ab3,"This piece is described as Alternative Rock, Rap, and R&B and conveys dynamic and neutral through its intense energy character."
5dda772a-b80c-4e6e-8257-1fbf28c8585e,"A Scream, Metal track featuring intense energy with dark and aggressive, creating a commanding atmosphere."
5e478d83-b421-4a87-a391-60d9920f63d0,The mix of low energy and gentle dynamics and stable tonality gives this piece a calm and pleasant feel.
5e518306-4dd9-417b-863d-be1bd9ce5fd5,"This Electro Hard Trap, Synth Funk, and Boombap Hip Hop piece conveys dark and aggressive through its high energy and powerful dynamics character."
5e927a50-2484-4ef4-a391-683962d1b634,"This piece is described as Fabloo, Lo-Fi, and Vaporwave and is marked by balanced dynamics, which gives it a cheerful and gentle and pleasant quality."
5efc5fd5-17f3-4a2a-a0d0-f5d5d5736d93,"This piece is described as Indie, Morrissey, and Male Voice and conveys calm and pleasant through its moderate energy character."
5f252ddf-9736-4c89-b277-357d3a58cf9c,The high energy and powerful dynamics character of this Jass Manouche and Oyojee piece gives it a bright and vibrant quality.
5f4a5c98-6ca5-452a-b33b-90e36857fe46,"A Trip Hop, Dubstep, Pop track featuring high energy and powerful dynamics with dark and aggressive, creating a commanding atmosphere."
5fc24d9f-1129-4371-964b-aea8d31f4bde,"Through its intense energy character, this Edm Chill Mario piece comes across as dark and aggressive."
5fe46525-b81b-447c-a53c-a825e6f6f96e,"This piece highlights strong intensity and complex tonality, which gives it a dynamic and neutral feel."
606a4d10-e3d5-4f67-bf69-92f625f5807f,"Marked by low energy and gentle dynamics, this New Age, Orchestra, and Opera piece takes on a calm and pleasant quality and comes across as peaceful."
609c8349-e58d-4adc-bdff-06ed1c993b51,"Marked by vigorous power, this Ballroom, Japanese Shoegaze, and Girl piece takes on a dynamic and neutral quality and comes across as versatile."
60ab12bd-ab50-471d-a065-063cdbfd9d7a,"Marked by high energy and powerful dynamics, this Disco, Techno, and Blues piece takes on a dynamic and neutral quality and comes across as balanced."
60e4c7cd-bbfb-417c-93b4-91d3ced93272,This Fast Tempo and Musical Vibe piece conveys dynamic and neutral through its intense energy character.
60e9fd42-fb86-4140-8569-9f10b2618e18,"With high energy and powerful dynamics and dissonant harmonic content, this piece comes across as dynamic and neutral."
60f7cb3f-96db-4f55-b0b6-348ff81540c1,"This piece is described as Studio Master, Shimmering Arpeggios, and Bright Synthesizers and is marked by intense energy, which gives it a dynamic and neutral and versatile quality."
611b5fa2-f8c8-4439-a567-4ca24373ebdf,"This Ska Rock piece highlights vigorous power and unstable structure, which gives it a dynamic and neutral feel."
614a5419-9afc-4dac-af88-6ad2502e55f5,"A Rap, Hiphop, Experimental track featuring high energy and powerful dynamics with dynamic and neutral, creating a balanced atmosphere."
618669bf-87aa-4e5e-aa64-3d7cf3fe47d2,"This piece is described as Dark Electric Rock and is marked by high energy and powerful dynamics, which gives it a dynamic and neutral and balanced quality."
61ba079d-7f04-41c1-a04c-0b3568622757,"With high energy and powerful dynamics and high tension, this Pirate Metal piece comes across as dark and aggressive."
6254d8ff-64bd-4df5-9269-5806f8d298bb,"A Yé-Yé, Female Vocals, Layered Vocals track featuring vigorous power with uplifting and energetic, creating a vibrant atmosphere."
6263aac1-2fd5-4e72-8671-b0b6cd234a25,"This piece is described as Energy: Spiritual, Uplifting, and Memorable Melody and conveys uplifting and energetic through its strong intensity character."
628083d1-90fe-4b28-8fd5-5c9731adf054,"This Rapper piece highlights vigorous power and dissonant harmonic content, which gives it a dynamic and neutral feel."
62b21c16-aceb-4b6f-a7ac-c691312537d1,"A Pop track featuring intense energy with dynamic and neutral, creating a versatile atmosphere."
62c09541-d0e3-436e-a4f3-122d52784efc,"This piece is described as Genres: Illbient, Ethereal, and Ancient] [Emotions: Peacefulness and features measured power and dynamic tonality, giving it a cheerful and gentle feel."
62cd9409-5539-417d-97fc-baa85f4d27db,"A Death Metal track featuring high energy and powerful dynamics with dark and aggressive, creating a intense atmosphere."
62e5d65a-91df-4981-b908-58b15d5079f4,"Through its high energy and powerful dynamics character, this Eerie Playful Spooky piece comes across as dynamic and neutral."
631c972c-de09-4c19-ba54-69d0fa4495cd,"A track featuring high energy and powerful dynamics with dynamic and neutral, creating a balanced atmosphere."
6320436e-5819-44d4-99d7-f73bd27e9591,"With steady intensity and unstable structure, this piece comes across as ambient and atmospheric."
63251cd1-9470-4ece-974d-e4099600dec8,"This piece is described as Jazz Pop and is marked by vigorous power, which gives it a dynamic and neutral and versatile quality."
635fec10-0828-4279-9b77-15600fc90ffb,"A track featuring strong intensity with dark and aggressive, creating a commanding atmosphere."
63b19f43-e693-4780-912c-a420088cfc3e,"This piece is described as Grand Rock Anthemic and features strong intensity and unstable structure, giving it a dark and aggressive feel."
63dc9f71-af24-46a2-a74e-722df00aa168,"This Creepy and Harmonic piece highlights high energy and powerful dynamics and dissonant harmonic content, which gives it a uplifting and energetic feel."
6417f82f-70f6-40b0-b959-6e2888ccfcfd,"This piece is described as Halloween Music, Halloween, and Scary and features vigorous power and dissonant harmonic content, giving it a dark and aggressive feel."
641d7367-8595-4f05-a9af-68fd608102a9,"This piece is described as Rege, Pop, and Rock and conveys dynamic and neutral through its high energy and powerful dynamics character."
645c2f28-54ca-42f8-8047-802462016eb6,"Marked by high energy and powerful dynamics, this Experimental Symphonic Rock piece takes on a dark and aggressive quality and comes across as intense."
647680fc-18ee-4ba3-ae62-04402b04a05c,"With high energy and powerful dynamics and high tension, this Nu-Metal Emotional Aggressive piece comes across as dark and aggressive."
647937c5-9afa-49db-9ad9-4e9f8867ca4a,This Beat Bass Dark piece is marked by strong intensity and has a dark and aggressive quality that feels intense.
64aefc2f-431c-4533-8d7b-ba9188c04e65,"A track featuring high energy and powerful dynamics with dynamic and neutral, creating a versatile atmosphere."
64eb0bea-4f62-48a0-9f15-c4ede3afc74f,The balanced dynamics character of this Dark Driving Epic piece gives it a ambient and atmospheric quality.
650d8710-9e17-44f5-a0d4-2f6bcb2a2a2c,This Melodic Soulful Pop piece conveys dynamic and neutral through its strong intensity character.
65288a4f-128b-45e2-ae3f-e1ae7152a795,The mix of strong intensity and high tension gives this Klasszikus Country piece a dynamic and neutral feel.
6565fccd-8c18-4ee8-9c2a-3bbe4f85331e,"Marked by intense energy, this Adorar piece takes on a bright and vibrant quality and comes across as spirited."
65b68787-e8c3-4a35-aa09-0d6d61960865,"This piece is described as Hip Hop, India Beat, and Percussion Lofi and features vigorous power and dissonant harmonic content, giving it a dynamic and neutral feel."
65d537e5-1acb-4b6f-9421-4acb0dba33f8,"With strong intensity and high tension, this piece comes across as bright and vibrant."
65d727fe-67c3-4002-abe1-a9994dbf98e1,"This piece is described as Pronounce Milena Right and Rock and is marked by intense energy, which gives it a dynamic and neutral and versatile quality."
662d35f6-6459-4f72-9607-02c774038b7d,"A Synth-Pop, Dance Rock track featuring intense energy with dark and aggressive, creating a powerful atmosphere."
663aeb6c-6c4e-4742-bf63-f2f4d2063a15,"A track featuring intense energy with dark and aggressive, creating a powerful atmosphere."
66422302-58fa-442c-a416-29e1328d2513,"A track featuring strong intensity with uplifting and energetic, creating a exhilarating atmosphere."
67299061-3170-4064-95aa-4e2d6c1f3c1a,"A Anime track featuring high energy and powerful dynamics with dynamic and neutral, creating a balanced atmosphere."
67c3f06b-9122-4079-9d35-6b4af74d0a23,"Through its moderate energy character, this Female Vocal, Progressive Rock, and Orchestral piece comes across as ambient and atmospheric."
68ad0685-bcac-4771-b80b-0e790adc14e0,The mix of vigorous power and dissonant harmonic content gives this piece a dynamic and neutral feel.
69080705-6ce4-476a-a3a1-fcc0057ab586,"A Progressive Metal, Alternative Metal, Art Rock track featuring strong intensity with uplifting and energetic, creating a lively atmosphere."
696e60df-407f-4601-94be-6325813788b8,"A Indie Surf track featuring high energy and powerful dynamics with dark and aggressive, creating a forceful atmosphere."
69a91451-39f5-45f6-8928-6db84c6b571f,"A track featuring high energy and powerful dynamics with dynamic and neutral, creating a adaptive atmosphere."
69d3f393-9c92-47ea-a8af-d789195a5f69,This Funky piece is marked by vigorous power and has a uplifting and energetic quality that feels vibrant.
6a23ae09-1478-4b8b-8a2d-1140dc5a0d16,"This Male Voice, Female Voice, and Melodic Metalcore piece conveys dark and aggressive through its intense energy character."
6a77d1b8-d1f1-4d1a-ae21-8072de528239,"This piece highlights intense energy and complex tonality, which gives it a dynamic and neutral feel."
6aa4e678-a790-447a-a508-07452dca4dd7,This piece is described as Rap and conveys dark and aggressive through its intense energy character.
6ae00409-f513-491e-b709-b0658f13530f,"This piece highlights strong intensity and complex tonality, which gives it a dynamic and neutral feel."
6b17a90a-1bb5-4904-9451-1ab8e80636d7,"This piece is described as Spooky Electronic Intense and features balanced dynamics and moderate tension, giving it a cheerful and gentle feel."
6b1c8829-9d9b-4dfd-beb0-acf91b35c527,"A Folk Song track featuring strong intensity with dynamic and neutral, creating a adaptive atmosphere."
6b1f04c5-d4e8-401f-80ba-5247f13653ad,"A track featuring high energy and powerful dynamics with dark and aggressive, creating a forceful atmosphere."
6b29eb03-f9f5-40af-bed4-15a6685a6d1f,"A track featuring high energy and powerful dynamics with dark and aggressive, creating a intense atmosphere."
6b411ea6-ecd6-4d63-80ec-4f591d86a4e7,"This piece highlights strong intensity and complex tonality, which gives it a dynamic and neutral feel."
6b50a804-a935-4465-bdc8-214c88b3b867,"This piece highlights vigorous power and complex tonality, which gives it a uplifting and energetic feel."
6b629e03-0fa9-495f-a1c0-b68033f5f078,"A Chillhop, Hip Hop, Pop track featuring vigorous power with dynamic and neutral, creating a adaptive atmosphere."
6b62aafe-dd81-43dd-8248-6ff1ff248e2f,"This piece is described as Rousing Choral Chorus, It’S A Soulful, and Glorious Song and is marked by strong intensity, which gives it a dynamic and neutral and balanced quality."
6b7d8845-b2bc-4126-b1a8-5f64c20f785f,This Alegre Dançante Pop piece is marked by strong intensity and has a dynamic and neutral quality that feels versatile.
6b8ec5f3-a565-40df-b854-40f90b38a9ec,"This piece is described as Funk and features strong intensity and unstable structure, giving it a dynamic and neutral feel."
6b91381d-5bc3-4f38-b464-d6d4dcb5fe65,"The mix of high energy and powerful dynamics and high tension gives this Cafe, Jazz, and Relax piece a dynamic and neutral feel."
6c06d687-68ac-4aeb-9b40-f5646cb38c1f,This piece is described as Rap and conveys dark and aggressive through its intense energy character.
6c0933d2-edaf-4fcf-abe9-3e712ae69dfe,"This Trashpop, Female Lead, and Slow Witch-House Ballad piece conveys dynamic and neutral through its high energy and powerful dynamics character."
6c17bab0-02bf-4e51-a582-5a3bf86a60d1,"This piece is described as Trap, Reggaeton, and Pop and features vigorous power and complex tonality, giving it a dynamic and neutral feel."
6c1e5d01-9762-4f54-9f6f-7d5cecfc3ea2,"A track featuring strong intensity with dark and aggressive, creating a intense atmosphere."
6c69016f-6e5a-4f64-9ad2-a9a5f4f3b777,"A Gospel Worships track featuring steady intensity with calm and pleasant, creating a peaceful atmosphere."
6cac085c-4c4a-4d45-a945-ededbf6625cc,"A Blues Rock track featuring strong intensity with dark and aggressive, creating a intense atmosphere."
6d2894a5-6025-43d4-a815-faedd3cff905,"A German Power Metal, Heavy Metal, Symphonic Metal track featuring moderate energy with cheerful and gentle, creating a welcoming atmosphere."
6d56532d-a167-42f2-8cf0-e6ae545e71ca,The mix of high energy and powerful dynamics and high tension gives this piece a dark and aggressive feel.
6d6533ff-f003-491e-b30c-e6f729a13dea,The steady intensity character of this Rock Comical Electric piece gives it a cheerful and gentle quality.
6db59e0e-8c15-4303-a89c-84ae3376c0fa,"This piece is described as Pop, J-Pop, and Idol and features strong intensity and dissonant harmonic content, giving it a dynamic and neutral feel."
6e0831a6-860f-4511-a83d-b3d6ee3a2079,"A Hardcore Violin, Glitch, Chiptune Melodies track featuring vigorous power with dark and aggressive, creating a commanding atmosphere."
6e3ba7df-4d99-47a5-b4b1-fd3659013102,"A Eighties, Female Vocals track featuring intense energy with dynamic and neutral, creating a balanced atmosphere."
6e4620a7-5d51-4374-b03a-749b162eacf6,The mix of high energy and powerful dynamics and high tension gives this piece a dynamic and neutral feel.
6e7d41c2-9dd5-4773-8051-d1f1153e751c,"With high energy and powerful dynamics and dissonant harmonic content, this piece comes across as dynamic and neutral."
6eab43be-5854-4486-9fdf-c8f4925b8d94,The low energy and gentle dynamics character of this Eurodance and Synthetizer piece gives it a calm and pleasant quality.
6f0d242d-8b0b-4549-8155-8cc4fd061ca1,"The mix of strong intensity and unstable structure gives this Trap, Hardtekk, and Glitch piece a dynamic and neutral feel."
6f2b6616-f222-4f2a-b9be-d89eea69e720,"A New-Age Music, Female Voice track featuring balanced dynamics with calm and pleasant, creating a peaceful atmosphere."
6f589f89-ed55-4dd5-a574-62fddfa52689,"With strong intensity and unstable structure, this piece comes across as dynamic and neutral."
6fd03854-7ce4-44f7-8655-0383fd9fcbd7,This Classic Rap and Opera piece is marked by intense energy and has a dynamic and neutral quality that feels adaptive.
6fe51ca2-168f-44e5-8369-077d630a3629,"A New Age, Orchestra, Folk track featuring intense energy with dynamic and neutral, creating a versatile atmosphere."
6ffae7ba-4a8c-403f-961f-ef2eb67c2fca,"This Medieval, Celtic, and Bard piece conveys dynamic and neutral through its vigorous power character."
703d08f2-2a36-444d-a470-1c0c01253f3d,"A Pop, Electro, Electronic track featuring balanced dynamics with ambient and atmospheric, creating a ethereal atmosphere."
7076d938-af24-46c7-ae82-6179f1e29332,"A Reggae Dub Influenced, Ambient, Indian Percussion track featuring strong intensity with uplifting and energetic, creating a lively atmosphere."
708399ad-bc59-4c2b-889e-ae6a0836ac7a,"With strong intensity and complex tonality, this Cinematic, Ascending, and Qanun piece comes across as dynamic and neutral."
70958de3-ecf6-47d3-8aa4-85f622ba62a6,"With intense energy and unstable structure, this Techno Trance piece comes across as dark and aggressive."
70990058-c7c9-4af2-9ab7-bd74cb3d183e,"This Folk, Americana, and Gospel piece highlights moderate energy and consonant structure, which gives it a cheerful and gentle feel."
70a16fb2-36d0-482b-aa93-311389f37bf2,"A Catchy, Female Singer, Feisty track featuring high energy and powerful dynamics with dark and aggressive, creating a forceful atmosphere."
70b6728a-afd4-490c-b9c6-e89de8c068e9,"Marked by vigorous power, this Lyrical Rap, Acoustic, and Soul piece takes on a dark and aggressive quality and comes across as forceful."
70bc4399-901a-48e2-9f04-ed8360236bd4,"This piece is described as Phonk and features moderate energy and dissonant harmonic content, giving it a ambient and atmospheric feel."
70c3071c-f06b-448b-9d8f-52306b1fcee8,The low energy and gentle dynamics character of this Power Rock piece gives it a calm and pleasant quality.
70e78e50-d077-4095-a5ae-a48e6171a10d,"A track featuring balanced dynamics with ambient and atmospheric, creating a immersive atmosphere."
70f3d8fa-37e0-4b5f-804e-b34a82caedf5,The high energy and powerful dynamics character of this Spooky Country piece gives it a dynamic and neutral quality.
713183ad-7934-4e3d-85f8-263d787bec31,"This piece is described as Alternative Hip Hop and Funk and features intense energy and high tension, giving it a dark and aggressive feel."
72031b26-f9db-4d2b-9baa-3fdae084d54a,"A Brain Rot, Horrible Music, Out Of Tune track featuring intense energy with dynamic and neutral, creating a balanced atmosphere."
7287e26a-9b61-4f6a-bae8-3c456349d135,"Through its vigorous power character, this Pop, Electronica, and Female Vocalist piece comes across as dark and aggressive."
72d8decc-dede-4674-ad26-47c313e22528,"This Female Robotic Voice, Distorded, and Industrial piece conveys dark and aggressive through its strong intensity character."
73171f05-37c5-45b4-8738-026ee1588bf0,"The intense energy character of this Deep Bass, Hard Drops, and Crisp Clear Audio piece gives it a dark and aggressive quality."
7360422d-91bb-4cf2-b276-ae17ee77ef03,"This Electronic Funky piece highlights vigorous power and high tension, which gives it a dark and aggressive feel."
73824829-c41a-452c-aa19-05ad88e6e98b,"A Acoustic Country Melodic track featuring high energy and powerful dynamics with bright and vibrant, creating a animated atmosphere."
73b3a738-6f71-48b8-9227-e664da9b7d81,"This Psychedelic Soul, Stoner Metal, and Female Vocalist piece is marked by high energy and powerful dynamics and has a dynamic and neutral quality that feels balanced."
742c9f39-ad26-4ed9-9597-b6663de2cc80,"A Afroswing track featuring strong intensity with dynamic and neutral, creating a balanced atmosphere."
74a05d48-f427-4922-91f8-fcb746366e17,"With strong intensity and complex tonality, this piece comes across as dark and aggressive."
74a57ac1-a447-4101-bb9a-3f20051fec6c,"The mix of intense energy and dissonant harmonic content gives this Kawaii, Kawaii Death Metal, and Heavy Metal piece a dark and aggressive feel."
74b21be7-8688-4080-b828-54d721e103c4,"A Reggae Laid-Back Smooth track featuring high energy and powerful dynamics with bright and vibrant, creating a spirited atmosphere."
74db8b86-b47e-4e3b-8e73-fd1ecd71adc6,"A Deep Growls, Female Chorus, Male Vocal track featuring strong intensity with dynamic and neutral, creating a adaptive atmosphere."
7535954c-b2d2-40b9-9a8a-65f504f184a6,"This piece is described as Walhala Blues, Eden Funk, and Paradise Flute and is marked by balanced dynamics, which gives it a calm and pleasant and soothing quality."
75f2a383-f39a-446a-8cdc-008a838bb0c3,"A track featuring measured power with calm and pleasant, creating a soothing atmosphere."
762c4129-2e6e-44e4-9c74-d55b29e3d94d,This Tradicional Acústico Chacarera piece is marked by measured power and has a ambient and atmospheric quality that feels spacious.
764b38be-9271-4166-a69c-c0b1bc7102b3,"This piece is described as Cartoon, Funny, and Pirate and features intense energy and high tension, giving it a dark and aggressive feel."
76bbbcb8-0af0-45f7-81ea-64c6d82d9de3,"A track featuring moderate energy with cheerful and gentle, creating a welcoming atmosphere."
76db742e-62e7-4460-ac83-19d73ba09094,"Through its strong intensity character, this Hip Hop piece comes across as dark and aggressive."
