track_id,caption
77224b9c-4c71-4b6f-bbba-db7ae2456223,"A Rap Pop track featuring high energy and powerful dynamics with dark and aggressive, creating a commanding atmosphere."
77b7bedf-42b7-447b-a17c-3d4322046d7a,"This piece is described as Reggae and Solo Trumpet and is marked by strong intensity, which gives it a dynamic and neutral and adaptive quality."
77fcf943-8e26-41bd-ab80-74517fdc750b,"Marked by strong intensity, this Rhythmic Pop piece takes on a dark and aggressive quality and comes across as powerful."
782a9b55-d3ec-46d3-b623-b701dcc14366,"With moderate energy and mixed consonance, this Melodic Edm, Progressive House, and Darkwave Synthwave piece comes across as cheerful and gentle."
786c676e-56ea-49d6-92af-3e9c393785e0,"Marked by balanced dynamics, this Pop, Sentimental, and Lush piece takes on a calm and pleasant quality and comes across as serene."
78e7a9b3-aeba-4cb9-826e-11dc55ed488a,"A track featuring intense energy with dark and aggressive, creating a commanding atmosphere."
78f86ee2-b60a-42a3-9779-b13961545c13,"A Edm, House track featuring high energy and powerful dynamics with dynamic and neutral, creating a adaptive atmosphere."
794ba293-8a71-406f-a837-5f93160503ee,"Marked by moderate energy, this Https, Suno.Com, and Style piece takes on a calm and pleasant quality and comes across as peaceful."
79883217-2b5a-4ad4-9d6b-79c31024a4bc,"A Emocional Pop Punk track featuring balanced dynamics with ambient and atmospheric, creating a immersive atmosphere."
79aa23bb-944c-45b3-b7fb-c47b4274c1d1,"This piece is described as Vibrant High-Energy Electronic and features steady intensity and relaxed harmonic content, giving it a cheerful and gentle feel."
79eb70f1-b2fd-4431-a3e3-5691bfed61ae,"This piece is described as Female Vocals, Playful, and Sassy and features strong intensity and dissonant harmonic content, giving it a dynamic and neutral feel."
7a36876f-3385-427d-b1ad-6917f3adeb7b,"Through its strong intensity character, this Slap House and K-Pop piece comes across as dark and aggressive."
7a779bc4-fc71-4e57-a94a-93d70cd46875,"This piece is described as Irish Rock, Orchestral, and Pop and features intense energy and balanced harmonic content, giving it a uplifting and energetic feel."
7a923700-6149-4ed3-9957-390586a8b8b4,"A Opera Singing, Symphonic Metal, Doom Metal track featuring moderate energy with ambient and atmospheric, creating a spacious atmosphere."
7b0b6192-fd0e-4e20-8fe4-2af2bdb45d96,The mix of restrained power and high tension gives this piece a ambient and atmospheric feel.
7b0e65c9-cfcf-4a2e-866f-6ae6125a40e7,"This Electronicore, Abstract, and Hip Hop piece is marked by vigorous power and has a dynamic and neutral quality that feels balanced."
7b21a990-0fee-467a-9fb5-014b0779ba60,"This piece is described as Emo Male Vocals, Emo Rap, and Interlude and is marked by strong intensity, which gives it a dark and aggressive and commanding quality."
7b8d1f00-717f-413a-9e22-076078258e41,"Marked by measured power, this Symphonic, Neoclassical Orchestral, and Opera piece takes on a ambient and atmospheric quality and comes across as spacious."
7ba03c40-89bf-49e2-966d-55fb7d38ebd9,"This piece highlights strong intensity and complex tonality, which gives it a dynamic and neutral feel."
7bf81fc5-420d-41df-9119-ff428a2bf6a4,The moderate energy character of this Hard Trance piece gives it a ambient and atmospheric quality.
7c255bb6-bf16-4a03-b04e-f20432ddcb0a,"Through its balanced dynamics character, this Trap Moody Electronic piece comes across as calm and pleasant."
7c864bc8-bb0c-4cb2-9e68-6473e50600f1,"This piece is described as Deep Male Vocals, Acoustic Guitar, and Steel Guitar and is marked by balanced dynamics, which gives it a ambient and atmospheric and immersive quality."
7c90cbfd-96f9-4663-9486-6d98691d1c4c,"A track featuring moderate energy with calm and pleasant, creating a tranquil atmosphere."
7cdc1c57-e140-4488-949d-4fa58f77ee1c,"This piece is described as Groovy, Japanese, and Funk and conveys dynamic and neutral through its high energy and powerful dynamics character."
7d48f076-e02d-4977-a208-3b6876c37416,The strong intensity character of this Rap piece gives it a dark and aggressive quality.
7db1f220-4300-44d5-abca-467dc2105d85,"Marked by high energy and powerful dynamics, this Fun Pop piece takes on a dynamic and neutral quality and comes across as versatile."
7dd3c24f-7153-40d7-adb4-c5a9ee110b3e,"The moderate energy character of this Ambient, Experimental, and Downtempo piece gives it a ambient and atmospheric quality."
7df20c98-3deb-4381-ac2e-dcabc17ee4d5,This Ambient Atmospheric Cinematic piece is marked by moderate energy and has a ambient and atmospheric quality that feels immersive.
7e3eedc9-388e-418e-be7e-6b774ee03d20,The mix of vigorous power and dissonant harmonic content gives this piece a dynamic and neutral feel.
7e5c4348-ba11-4a8b-9984-97deabe23140,"The vigorous power character of this Epic Drum Solo, March, and Sailor Choir piece gives it a dynamic and neutral quality."
7effe6ea-f76b-4f5c-a747-fdf1017927a2,"This Hip-Hop and R&B Fusion piece highlights vigorous power and dissonant harmonic content, which gives it a dynamic and neutral feel."
7f08888d-ef80-48f8-a6e9-2335dfaa4cd9,"A Rock, Fork Rock, Celtic Folk Music track featuring moderate energy with calm and pleasant, creating a serene atmosphere."
7f21b33a-18bf-4de9-b60a-da97babe9a53,The mix of high energy and powerful dynamics and high tension gives this piece a dark and aggressive feel.
7f41a999-fe04-4efb-9bf5-6c9096c4bb7e,"Through its high energy and powerful dynamics character, this Empowering Pop piece comes across as dynamic and neutral."
7f675728-e89f-4a71-9b8f-0d240256d09f,"This piece is described as Intense Electronic Pulsating and features intense energy and dissonant harmonic content, giving it a dark and aggressive feel."
7f7bb1e0-1249-41a8-a914-fb4a86b87d7e,"The high energy and powerful dynamics character of this Electronic, Experimental, and Rock piece gives it a dark and aggressive quality."
7fc32d98-1ee8-444e-8fc3-7d28a0b13129,"This piece is described as Hard Bass, Trance, and House and conveys ambient and atmospheric through its steady intensity character."
7fcc4cc1-bde1-43ad-bb39-cd568e74db26,"A Rap, Hard Rock, Grunge track featuring intense energy with dark and aggressive, creating a intense atmosphere."
800b42cb-7f0d-4f09-81fc-68f8e2cd56bd,"This piece is described as Future Tropical and Violin Upbeat Ensemble and features intense energy and dissonant harmonic content, giving it a uplifting and energetic feel."
801f5f6e-3cf2-4e98-a6ba-a143eefa4d0d,This Deep House and Female Voice piece conveys uplifting and energetic through its intense energy character.
807a13d5-601a-40d8-a9c1-2098d4a1aef4,"This piece is described as Dark Orchestration, Metalcore, and Industrial Techno and features intense energy and dissonant harmonic content, giving it a dark and aggressive feel."
817e59a1-c985-4141-9bad-29cd9266a55a,"Marked by high energy and powerful dynamics, this Postnuclear Winter Jazz piece takes on a dynamic and neutral quality and comes across as multifaceted."
820784cc-db4f-41c9-a8df-340d94843ffa,"Through its strong intensity character, this Pop and Vocaloid piece comes across as dark and aggressive."
828cfae4-b709-4c49-af3d-3a9140bc0325,"A track featuring calm intensity with ambient and atmospheric, creating a immersive atmosphere."
8292c83f-4597-454b-b114-fd2134ebdd2b,"This piece is described as Scandinavian Folk, Traditional Norse, and Shamanic and conveys dynamic and neutral through its high energy and powerful dynamics character."
8294a968-089c-4ba7-9c0d-805934477adb,"This piece is described as Country Acoustic and features high energy and powerful dynamics and unstable structure, giving it a dynamic and neutral feel."
82f7b21b-189e-4575-9e46-3f35420ef6e6,"A Female Solo, Banger Atmospheric Trap track featuring strong intensity with bright and vibrant, creating a radiant atmosphere."
835622bb-cf9c-4c20-ab91-7e4556255704,"Marked by strong intensity, this Ska piece takes on a dynamic and neutral quality and comes across as balanced."
83630919-f07c-43b1-980a-30945bdfebf4,"Through its strong intensity character, this Hyper-Pop Hip-Hop, Chill Dubstep, and Dancehall piece comes across as dynamic and neutral."
83a8d303-cc39-4e4f-86ee-334aa59029f7,"Through its intense energy character, this Hardcore, Speedcore, and Hard-Techno piece comes across as dark and aggressive."
841e87dc-c4a7-459b-a6e4-a77533542bed,"This piece is described as Rap, Hip Hop, and Trip Hop and conveys dynamic and neutral through its strong intensity character."
846392b5-5b23-42e3-8e71-caecf3d721e6,This Pop Engaging piece conveys calm and pleasant through its measured power character.
849bf455-7575-4152-95bc-251de27e8317,The intense energy character of this Pop Poetisk Melodisk piece gives it a dynamic and neutral quality.
84f92058-0718-4c1e-80ba-dbade7b893a4,"This piece is described as Breakcore, Unusual, and Loud and features balanced dynamics and dynamic tonality, giving it a ambient and atmospheric feel."
85a640a3-fb60-4255-8f14-716296b54f99,"This piece is described as Heavy Metal and Hard Rock and is marked by strong intensity, which gives it a dark and aggressive and forceful quality."
85ce8d5a-160d-4ee4-acf3-15c3b1a63ba8,"Through its vigorous power character, this Epic To Dance, Trap And Hardstyle, and Dj Scratching piece comes across as uplifting and energetic."
85e8186d-0178-47d4-93dd-0ecf04982709,"A track featuring high energy and powerful dynamics with uplifting and energetic, creating a lively atmosphere."
860f0e97-40cb-4c9a-b3a8-39c1380f84ba,The high energy and powerful dynamics character of this Pop Rock piece gives it a dynamic and neutral quality.
8618323c-ee39-43ee-91d5-15a4dd84a0f3,This Dark Rock Intense piece is marked by balanced dynamics and has a calm and pleasant quality that feels soothing.
8633c842-365a-42ef-b810-320fdc8c8309,"Marked by intense energy, this Video Game Music, Soundtrack, and Orchestra piece takes on a dark and aggressive quality and comes across as forceful."
86a80f21-d120-4fd8-9e1a-80a073af5969,"This Warm Vibe, Blend Genres, and Calm Contemporary Jazz piece highlights strong intensity and dissonant harmonic content, which gives it a dynamic and neutral feel."
8720c958-a079-4b84-a125-33c19ffe9264,This Power Metal piece is marked by moderate energy and has a subdued and introspective quality that feels understated.
873c9a2f-3995-4b45-ba09-9227245de058,"A Chiptune, Elec Guitar, Final Boss Theme track featuring intense energy with dark and aggressive, creating a intense atmosphere."
87eb9183-a518-4e57-953d-0650efb9b5fe,"This Mellow Rage, Country Rock, and Metal Choir piece is marked by intense energy and has a dark and aggressive quality that feels intense."
883428ef-08b4-4be1-955d-857a4f5cb0ca,"A Rhythm-Driven Pop track featuring high energy and powerful dynamics with dynamic and neutral, creating a multifaceted atmosphere."
88500417-f336-4469-bc81-f63f0b294168,"Marked by vigorous power, this Pop Ballad, Pop Rock, and Emotional Song piece takes on a dynamic and neutral quality and comes across as adaptive."
887225e0-ac9a-4b2e-bf4a-c030213ba9b8,"This piece is described as Sweet, Love Triangle, and Solo Song and is marked by vigorous power, which gives it a uplifting and energetic and vibrant quality."
88870ad2-a005-4166-8212-5528a2f705c0,"A track featuring moderate energy with ambient and atmospheric, creating a ethereal atmosphere."
88e71583-9a2e-4001-a1af-9f8442d8a988,"A Progressive Power Metal, Techno, Electro track featuring high energy and powerful dynamics with dark and aggressive, creating a forceful atmosphere."
89229040-3bea-4a25-aebc-0d245fa9f471,"This piece is described as Pop Emotional and is marked by steady intensity, which gives it a ambient and atmospheric and immersive quality."
89a6c84f-cd3f-4757-b25a-bfcc10d108cc,"A Nu Metal, Metalcore, Melodic Death track featuring measured power with ambient and atmospheric, creating a textural atmosphere."
8a0160b7-9bba-455c-a8aa-42285d7d2dba,The mix of strong intensity and dissonant harmonic content gives this piece a dark and aggressive feel.
8a0b1b6d-b4ec-4e0c-9f76-31036b673464,"A Dissonant Singer.Shambolic Saxophonist, Experimental Guitar, Theorist track featuring high energy and powerful dynamics with dynamic and neutral, creating a multifaceted atmosphere."
8a1373e9-bdfc-4c64-8e45-b22235e5239c,"A track featuring high energy and powerful dynamics with dynamic and neutral, creating a multifaceted atmosphere."
8a397d29-4a5c-4c56-b18b-68ae7b945897,"A Dance Loop Hiphop track featuring intense energy with dynamic and neutral, creating a multifaceted atmosphere."
8a6a5b52-63a1-49b4-88b1-60cd071b29c5,The mix of intense energy and dissonant harmonic content gives this piece a dynamic and neutral feel.
8b23bd63-8717-462b-8859-7782544efb38,"This piece is described as Old Hymn, Soul, and Choirs and conveys cheerful and gentle through its steady intensity character."
8b7f638d-7009-444d-857c-3fe99da19ce1,"This Male Voice, Rap, and Female Chorus piece is marked by steady intensity and has a subdued and introspective quality that feels nuanced."
8b937bd3-7ecc-4e5d-ae53-607003f448b7,"This piece is described as Relentless Nu Metal, Heavy Riffs, and And Percussion Metal and features intense energy and high tension, giving it a dark and aggressive feel."
8c4915f3-7c6a-479d-b064-9eed73596e8f,"The vigorous power character of this Shimmering Synths, Lively Drums, and Upbeat Guitar Licks piece gives it a dark and aggressive quality."
8ce76d83-e4d7-4077-8ba8-b946d979ef18,"The mix of intense energy and complex tonality gives this Downbeat, Classic Rock, and Accordeon piece a dark and aggressive feel."
8d300ee1-dbc0-46ec-ad8a-c9ff381a4f5e,"This R&B, Soul, and Roots Reggae piece is marked by strong intensity and has a dynamic and neutral quality that feels adaptive."
8d9a5941-6d4d-429e-8a01-19a1a656ac72,This piece is described as Pop Rock Playful and conveys dynamic and neutral through its vigorous power character.
8ddb30f7-aa79-4a8b-8b85-a6b09f0e0b5e,"With calm intensity and dynamic tonality, this piece comes across as calm and pleasant."
8dfe5a0b-90ab-4037-9470-ff856abb6cc5,"The mix of strong intensity and high tension gives this Funky, Russian, and Groove piece a dark and aggressive feel."
8e800de9-100f-429a-84da-a1f1b7023aef,"With vigorous power and high tension, this piece comes across as dynamic and neutral."
8ec344cd-86e7-474f-9496-05bdb3926adf,"Marked by strong intensity, this Celtic, Irish, and Mythical piece takes on a uplifting and energetic quality and comes across as lively."
8ec90532-4e7a-47b4-bffc-fd434e427504,"This Emotional, Hardcore, and Christian piece is marked by high energy and powerful dynamics and has a dynamic and neutral quality that feels balanced."
8f93368b-99f2-4d1c-85b8-79f8d68f5a32,"A track featuring moderate energy with calm and pleasant, creating a peaceful atmosphere."
8fd882c0-f449-4d67-a93f-cd332c337314,The mix of steady intensity and dissonant harmonic content gives this piece a ambient and atmospheric feel.
900b0505-5d38-4df2-8a81-070ccb3e8f4f,"A track featuring strong intensity with uplifting and energetic, creating a dynamic atmosphere."
903a1e8e-ee15-4b43-9188-e978b8cb64d5,"This Anthemic Rock Song, Soaring Vocals, and Piano-Driven Melody piece conveys dynamic and neutral through its vigorous power character."
912ba083-04d6-4748-92ae-c356631ee0e2,"This piece is described as Cold Wave, Electronic, and Electro and conveys dark and aggressive through its vigorous power character."
91a7af1a-3fab-47e9-a32e-84bde966f83d,"A German Hwvoice track featuring intense energy with dynamic and neutral, creating a balanced atmosphere."
926586a9-01c2-40ce-a754-533d47cc0e8b,"With intense energy and unstable structure, this piece comes across as dark and aggressive."
92b48ccb-cdfb-45be-90ef-1972c4eb2b05,"This Country Melodic Acoustic piece highlights high energy and powerful dynamics and high tension, which gives it a dark and aggressive feel."
92c5f4ce-560d-4b3b-bbbb-f01584d5cc79,"A Slow Ballad, Crescendo Dynamic, Kawaii Anime track featuring restrained power with calm and pleasant, creating a soothing atmosphere."
92dd0cf1-d272-437e-a925-f2f192f24f8d,"Marked by vigorous power, this Dubstep, Brostep, and Glitch piece takes on a dark and aggressive quality and comes across as commanding."
92f023df-e447-4dec-b7e1-ddc5777f6c99,"A Voces Claras, Samba, Rumba track featuring steady intensity with calm and pleasant, creating a serene atmosphere."
9346ed51-43ef-491c-87a8-da3890487613,"A Jazz track featuring balanced dynamics with cheerful and gentle, creating a comforting atmosphere."
93c68c29-1bc3-4453-bcef-ad589240cdb6,"With strong intensity and unstable structure, this Rap Eerie Bass-Heavy piece comes across as dark and aggressive."
93f91610-6602-4191-af48-7dce776c7707,"This piece is described as Soulful Female Vocals, P-Funk, and Funk and is marked by high energy and powerful dynamics, which gives it a dynamic and neutral and adaptive quality."
940aaf0a-4c26-462b-9e80-926ba89b3e64,"Marked by intense energy, this Electronic piece takes on a dynamic and neutral quality and comes across as versatile."
95bab824-3b1c-4c3d-bd7b-b79172574465,"A Female Singer track featuring strong intensity with uplifting and energetic, creating a dynamic atmosphere."
95c749ff-51d5-4817-b786-f52407ce46ab,"A Major Key, Cool track featuring intense energy with dark and aggressive, creating a intense atmosphere."
95dc5b93-010b-4a16-9e93-d8762d0b2ea4,"A track featuring moderate energy with cheerful and gentle, creating a welcoming atmosphere."
95fa5d1b-bc5d-4945-b757-1cfc74643f2c,"Marked by vigorous power, this Rock Electric Energetic piece takes on a dark and aggressive quality and comes across as forceful."
9642086a-d825-4f5f-94b6-60e0ee5ca8fa,"This piece is described as Saz Only and Baglama Solo and is marked by balanced dynamics, which gives it a ambient and atmospheric and spacious quality."
96696af7-c518-430c-9e11-10ea869d1938,"A track featuring steady intensity with calm and pleasant, creating a soothing atmosphere."
978ab667-93b9-4a14-a5cb-4155bd9d9447,"A Female Singer, Male Singer, Drum track featuring moderate energy with ambient and atmospheric, creating a spacious atmosphere."
97c1f868-5b7a-495d-8ceb-bf1a179c4f16,"With steady intensity and high tension, this Deep Flow, Electronica, and Contemporary Country piece comes across as ambient and atmospheric."
9856d5d2-84d8-4aa5-937a-fd02befacd93,"This Tokyo Night Pop, Jersey Club, and Pipe piece conveys dynamic and neutral through its intense energy character."
998fd422-b876-4ad0-bdb0-e503cc28c22a,"With strong intensity and unstable structure, this piece comes across as dark and aggressive."
99c39941-543b-4189-9557-2ae09003baba,"Marked by intense energy, this Pop Funky piece takes on a dark and aggressive quality and comes across as commanding."
99c55e35-ae14-499c-a389-5ccc90234036,"A Brutal Melódico Metal track featuring vigorous power with dark and aggressive, creating a commanding atmosphere."
99d4e813-fd8e-4eb4-92a3-c41c4dddebfb,The vigorous power character of this Hip Hop and Rap piece gives it a dynamic and neutral quality.
99d7683e-78ae-42ea-8d0f-be60d8d82c5c,"This Male Voice, Alternative Rock, and Classic Rock piece conveys dark and aggressive through its intense energy character."
99d9b30f-e8fc-43c9-bf8a-711cf994c92f,"A track featuring balanced dynamics with ambient and atmospheric, creating a spacious atmosphere."
99f829e5-6571-4b2c-bdf4-ef92bab52bab,"A Bollywood, Indian Classical, Inspirational track featuring calm intensity with ambient and atmospheric, creating a immersive atmosphere."
9a2a2b44-7a06-47c7-bf88-aa132bd15a34,"Through its steady intensity character, this Folk piece comes across as ambient and atmospheric."
9a3efcc3-5ddf-4ea9-8352-ece03db95f59,"A Epic Rock, Mythological, Dark Electropop track featuring vigorous power with dark and aggressive, creating a commanding atmosphere."
9a5aec81-1aa4-4599-81a5-06ed73998a87,The mix of high energy and powerful dynamics and consonant structure gives this Plugg and Trap piece a uplifting and energetic feel.
9a5b93fb-2021-4a25-8ea4-8dc753e8d521,"The mix of high energy and powerful dynamics and complex tonality gives this Intense Piano Lead, Storytelling Rap, and Rapid Delivery piece a dynamic and neutral feel."
9adc133f-2098-44bb-8aa2-29626914c71a,"This piece is described as Merseybeat, Psychedelic, and Rap and conveys dark and aggressive through its high energy and powerful dynamics character."
9b406043-368d-4e63-ae4b-a9d706f2ac66,This Blues Gritty Soulful piece is marked by high energy and powerful dynamics and has a dark and aggressive quality that feels intense.
9b79f9c5-c43d-4c58-90a4-61fa6696f150,"This Fusion piece highlights high energy and powerful dynamics and unstable structure, which gives it a dynamic and neutral feel."
9bb2ff1e-cb55-494c-9cef-5d8fb05cf3bf,"The mix of high energy and powerful dynamics and unstable structure gives this R&B, Voce Femminile, and Emozionale piece a dynamic and neutral feel."
9bda4516-3cd4-4e07-9465-62bacd40b722,The mix of intense energy and dissonant harmonic content gives this piece a dynamic and neutral feel.
9c303133-8f50-45ed-bf15-c9af9db0c2a8,"A track featuring moderate energy with ambient and atmospheric, creating a immersive atmosphere."
9c6035f9-970c-453d-a8bd-cb3ce2e2f519,This Accordion Drill piece conveys dark and aggressive through its vigorous power character.
9dd67553-3c52-424c-b247-b396c3d30950,"With measured power and unstable structure, this piece comes across as ambient and atmospheric."
9e0fd25f-31cd-43a7-9946-06d1b0d84039,"A Hard Rock track featuring high energy and powerful dynamics with dynamic and neutral, creating a balanced atmosphere."
9e42cd0b-6ab5-41de-bc91-c260820cc566,"A Heavy Metal, Nu Metal track featuring strong intensity with dark and aggressive, creating a powerful atmosphere."
9e701bda-2552-4a3b-8ab8-73803f47628a,"A track featuring strong intensity with dynamic and neutral, creating a adaptive atmosphere."
9fdec2e3-241f-4d1d-ac5e-b697dbd93cdb,"A Cinematic Sadness, Circuit, Freak Show track featuring measured power with subdued and introspective, creating a understated atmosphere."
a07f6d99-86fc-453a-a94a-aacd3743c7d1,"Through its high energy and powerful dynamics character, this Mariya Takeuchi piece comes across as uplifting and energetic."
a08e2111-4c89-40a4-a401-10cd3305233e,"A track featuring strong intensity with dark and aggressive, creating a intense atmosphere."
a0f32aef-038f-4b7f-be03-8d7d334b8396,"Marked by high energy and powerful dynamics, this Rap piece takes on a dynamic and neutral quality and comes across as versatile."
a1bbeac7-a2dd-49b1-9f78-3a26f5b1a4b3,"The balanced dynamics character of this Sad Electro Soul, Chunky Guitar Riffs, and Hypnotic Atmosphere piece gives it a calm and pleasant quality."
a1f021a5-be96-4edf-844e-827309bde367,"With high energy and powerful dynamics and unstable structure, this piece comes across as dark and aggressive."
a21f652c-7964-4201-9882-c1f5a3e4fdb5,"This piece highlights vigorous power and dissonant harmonic content, which gives it a dark and aggressive feel."
a23b5616-03e5-4fed-9818-0b1c60360675,The mix of strong intensity and complex tonality gives this piece a uplifting and energetic feel.
a23f5675-0ffa-4ae7-93df-ae190ff82c7f,"This piece is described as Medieval Viking Rock and Medieval Folk and features vigorous power and dissonant harmonic content, giving it a dynamic and neutral feel."
a28a04c5-664a-450b-99c4-e211ac256bc7,"With strong intensity and high tension, this piece comes across as dark and aggressive."
a2a3abe7-32bf-41f1-a1d5-099594af442f,"A Country, Western Guitar, Eurodance track featuring high energy and powerful dynamics with dynamic and neutral, creating a adaptive atmosphere."
a2c8a6f5-3350-4507-8349-88b2da0f2b11,"A track featuring high energy and powerful dynamics with dynamic and neutral, creating a multifaceted atmosphere."
a2d3bef9-e422-4c07-8578-fac3c9b164f6,"A Hardcore, Metal, Symphonic track featuring strong intensity with dynamic and neutral, creating a balanced atmosphere."
a353ab25-e5aa-4a06-8801-207c8e780b94,"A track featuring high energy and powerful dynamics with dark and aggressive, creating a forceful atmosphere."
a35dfc0f-b237-4168-a941-622456d3222b,"A track featuring intense energy with dark and aggressive, creating a forceful atmosphere."
a368d698-b242-4a69-8855-f277bd419299,"A Post-Hardcore, Minimal Glitchore Elements track featuring intense energy with dark and aggressive, creating a intense atmosphere."
a3e0afb9-7c48-44f5-a189-668a02659801,"A track featuring strong intensity with dark and aggressive, creating a forceful atmosphere."
a40863b9-9e13-497e-9bbf-d4184c017b5c,"This Mystical Electronics, Dark Jazz, and Dark Cabaret piece highlights high energy and powerful dynamics and dissonant harmonic content, which gives it a dark and aggressive feel."
a41567aa-e37f-4fc0-9d45-5095ebef6c7c,This Ballad Sad Melancholic piece conveys calm and pleasant through its subdued energy character.
a41e1932-28bb-4ee6-bdef-f3c6a8c3878c,This Beat And Bass piece is marked by intense energy and has a dark and aggressive quality that feels powerful.
a4d4c05a-0bcb-4f48-88d4-f748870a3084,The vigorous power character of this Hip Hop piece gives it a dark and aggressive quality.
a4f43a9d-65eb-4ce7-b36f-95005ea8811d,"Through its vigorous power character, this Retro Rock, Americana, and Psychedelic Rock piece comes across as dynamic and neutral."
a4f7d934-bdf7-4c88-ab9c-c9e19e653d0b,"This piece is described as Jazz, Blues, and Indie Pop and features intense energy and dissonant harmonic content, giving it a dynamic and neutral feel."
